{
  "id": "550e8400-e29b-41d4-a716-446655440007",
  "metadata": {
    "created_at": "2026-01-16T10:38:45Z",
    "llm_model": "gpt-4-turbo",
    "llm_version": "2024-01-15",
    "llm_seed": 312,
    "context_hash": "a9b0c1d2e3f4a5b6c7d8e9fa0b1c2d3e",
    "confidence_score": 0.86,
    "generation_time_ms": 1890,
    "actor": "ai_writer_v1"
  },
  "story_context": {
    "story_id": "demo-story-2024",
    "story_title": "The Lost Expedition",
    "current_scene": "chapter_4.rival_encounter",
    "player_action": "stumbled upon the rival explorer in the hidden canyon",
    "player_inventory": ["torn_map", "grandfather_compass", "leather_satchel", "silver_coin", "temple_key"],
    "player_state": {
      "health": 65,
      "reputation": "persistent_seeker",
      "morale": 0.7,
      "exhaustion": 0.5
    },
    "character_state": {
      "rival_explorer": {
        "mood": "surprised_then_calculating",
        "relationship": "competitive",
        "objective": "secure_artifact_first",
        "competency": "high"
      }
    },
    "recent_events": [
      "Traveled through dangerous terrain",
      "Found evidence rival was nearby",
      "Unexpected canyon intersection revealed both parties"
    ],
    "narrative_pacing_hint": "climactic",
    "story_themes": ["competition", "discovery", "skill", "honor"]
  },
  "content": {
    "branch_type": "narrative_delta",
    "text": "The rival explorer stood atop the canyon's far ridge, breathing hard, holding a piece of the map you thought was lost. A slow grin spread across their weathered face. 'Well, well. Look who found their way after all.' They raised the map fragment. 'Seems we're after the same prize. Care to make this interesting? Winner takes allâ€”including the artifacts both our families have been searching for.'",
    "character_voice": "rival_explorer",
    "length_tokens": 69,
    "ink_tags": ["dialogue", "competition", "stakes_raised"],
    "return_path": "chapter_4.rival_proposition",
    "return_path_confidence": 0.87
  },
  "constraints": {
    "max_length_tokens": 150,
    "prohibited_patterns": ["out_of_character_villain", "removes_player_choice"],
    "style_template": "noir_explorer"
  }
}
