{
  "id": "550e8400-e29b-41d4-a716-446655440004",
  "metadata": {
    "created_at": "2026-01-16T10:34:20Z",
    "llm_model": "gpt-4-turbo",
    "llm_version": "2024-01-15",
    "llm_seed": 145,
    "context_hash": "d6e7f8a9b0c1d2e3f4a5b6c7d8e9fa0b",
    "confidence_score": 0.84,
    "generation_time_ms": 2100,
    "actor": "ai_writer_v1"
  },
  "story_context": {
    "story_id": "demo-story-2024",
    "story_title": "The Lost Expedition",
    "current_scene": "chapter_5.hidden_temple_entrance",
    "player_action": "touched the ancient stone altar",
    "player_inventory": ["torn_map", "grandfather_compass", "leather_satchel", "temple_key_found"],
    "player_state": {
      "health": 42,
      "reputation": "accursed_explorer",
      "morale": 0.3,
      "exhaustion": 0.85,
      "magical_resonance": 0.55
    },
    "character_state": {
      "temple_spirit": {
        "awakened": true,
        "relationship": "unknown",
        "objective": "evaluate_intruder"
      }
    },
    "recent_events": [
      "Forest revealed ancient temple entrance",
      "Player found first temple key",
      "Ground shook with otherworldly energy"
    ],
    "narrative_pacing_hint": "climactic",
    "story_themes": ["forbidden_knowledge", "ancient_power", "moral_choice", "redemption"]
  },
  "content": {
    "branch_type": "ink_knot",
    "text": "=== temple_spirit_awakens ===\nThe altar pulsed with sickly blue light. A voice—ancient, layered, speaking in harmonics that made your teeth ache—resonated from the stone itself: 'One who carries the Compass. You are either brave or foolish. Likely both.' The air crystallized around you, and shadows coalesced into a half-seen form. 'Your ancestor promised to return. Did he send you in his stead?'\n\n* [Claim the compass is destiny] -> temple_spirit_accepts\n* [Ask who your ancestor was] -> temple_spirit_explains\n* [Try to flee] -> temple_spirit_blocks",
    "character_voice": "temple_spirit",
    "length_tokens": 98,
    "ink_tags": ["dialogue", "supernatural", "major_revelation"],
    "return_path": "chapter_5.spirit_judgment",
    "return_path_confidence": 0.85
  },
  "constraints": {
    "max_length_tokens": 200,
    "prohibited_patterns": ["incoherent_voice", "mundane_explanation", "contradicts_family_history"],
    "style_template": "noir_explorer"
  }
}
