{
  "id": "550e8400-e29b-41d4-a716-446655440002",
  "metadata": {
    "created_at": "2026-01-16T10:31:15Z",
    "llm_model": "gpt-4-turbo",
    "llm_version": "2024-01-15",
    "llm_seed": 43,
    "context_hash": "b4c5d6e7f8a9b0c1d2e3f4a5b6c7d8e9",
    "confidence_score": 0.87,
    "generation_time_ms": 1680,
    "actor": "ai_writer_v1"
  },
  "story_context": {
    "story_id": "demo-story-2024",
    "story_title": "The Lost Expedition",
    "current_scene": "chapter_3.tavern_meeting",
    "player_action": "asked the innkeeper about rumors of the artifact",
    "player_inventory": ["torn_map", "grandfather_compass", "leather_satchel", "silver_coin"],
    "player_state": {
      "health": 72,
      "reputation": "mysterious_traveler",
      "morale": 0.6,
      "exhaustion": 0.4
    },
    "character_state": {
      "innkeeper": {
        "mood": "cautious",
        "relationship": "neutral",
        "objective": "protect_patrons",
        "chatty": false
      }
    },
    "recent_events": [
      "Guard revealed cryptic knowledge",
      "Player reached the tavern at nightfall",
      "Innkeeper poured ale with a wary eye"
    ],
    "narrative_pacing_hint": "exposition",
    "story_themes": ["discovery", "forbidden_knowledge", "betrayal"]
  },
  "content": {
    "branch_type": "narrative_delta",
    "text": "The innkeeper's eyes narrowed at your question. He set down his glass slowly, deliberately. Around the tavern, conversations dimmed as if the very air had thickened. 'You're asking the wrong question,' he said finally, his voice low. 'The artifact isn't lost. It's hidden. And there are reasons for that.'",
    "character_voice": "innkeeper",
    "length_tokens": 54,
    "ink_tags": ["dialogue", "exposition", "tension"],
    "return_path": "chapter_3.innkeeper_hints_at_danger",
    "return_path_confidence": 0.89
  },
  "constraints": {
    "max_length_tokens": 120,
    "prohibited_patterns": ["direct_revelation", "out_of_theme"],
    "style_template": "noir_explorer"
  }
}
