{
  "id": "550e8400-e29b-41d4-a716-446655440001",
  "metadata": {
    "created_at": "2026-01-16T10:30:00Z",
    "llm_model": "gpt-4-turbo",
    "llm_version": "2024-01-15",
    "llm_seed": 42,
    "context_hash": "a3b4c5d6e7f8a9b0c1d2e3f4a5b6c7d8",
    "confidence_score": 0.92,
    "generation_time_ms": 1250,
    "actor": "ai_writer_v1"
  },
  "story_context": {
    "story_id": "demo-story-2024",
    "story_title": "The Lost Expedition",
    "current_scene": "chapter_2.encounter_with_guard",
    "player_action": "chose to confront the guard directly",
    "player_inventory": ["torn_map", "grandfather_compass", "leather_satchel"],
    "player_state": {
      "health": 85,
      "reputation": "cautious_stranger",
      "morale": 0.7
    },
    "character_state": {
      "guard_captain": {
        "mood": "suspicious",
        "relationship": "neutral",
        "objective": "protect_fortress_entrance"
      },
      "narrator": {
        "tone": "mysterious",
        "pov": "third_person_limited"
      }
    },
    "recent_events": [
      "Player discovered cryptic message in old library",
      "Player traveled three days to the fortress",
      "Guard demanded papers at the gate"
    ],
    "narrative_pacing_hint": "climactic",
    "story_themes": ["discovery", "redemption", "forbidden_knowledge"]
  },
  "content": {
    "branch_type": "ink_fragment",
    "text": "The guard's hand instinctively moved toward his sword hilt. 'You dare speak to me with such insolence?' he growled, his weathered face darkening. But something in your eyes—a recognition, perhaps—made him pause. His grip loosened. 'Wait,' he muttered, studying you more carefully. 'That compass... I knew someone who carried one like that. Long ago.'",
    "character_voice": "narrator",
    "length_tokens": 62,
    "ink_tags": ["dialogue", "tension", "character_interaction"],
    "return_path": "chapter_2.guard_reveals_knowledge",
    "return_path_confidence": 0.95
  },
  "constraints": {
    "max_length_tokens": 100,
    "prohibited_patterns": ["sudden_violence", "out_of_character_dialogue"],
    "style_template": "noir_explorer"
  }
}
