{
  "id": "550e8400-e29b-41d4-a716-446655440009",
  "metadata": {
    "created_at": "2026-01-16T10:41:35Z",
    "llm_model": "gpt-4-turbo",
    "llm_version": "2024-01-15",
    "llm_seed": 456,
    "context_hash": "c1d2e3f4a5b6c7d8e9fa0b1c2d3e4f5g",
    "confidence_score": 0.88,
    "generation_time_ms": 1720,
    "actor": "ai_writer_v1"
  },
  "story_context": {
    "story_id": "demo-story-2024",
    "story_title": "The Lost Expedition",
    "current_scene": "chapter_6.revelation_scene",
    "player_action": "held the artifact and memories flooded in",
    "player_inventory": ["torn_map", "grandfather_compass", "leather_satchel", "silver_coin", "temple_key", "artifact_in_hand"],
    "player_state": {
      "health": 25,
      "reputation": "bearer_of_legacy",
      "morale": 0.7,
      "exhaustion": 0.95,
      "spiritual_connection": 1.0,
      "awakened": true
    },
    "character_state": {
      "grandfather_spirit": {
        "mood": "proud",
        "relationship": "reunion",
        "objective": "pass_knowledge"
      }
    },
    "recent_events": [
      "Took hold of the artifact",
      "Visions flooded player's mind",
      "Grandfather's final moments revealed",
      "Truth about the compass unfolds"
    ],
    "narrative_pacing_hint": "resolution",
    "story_themes": ["redemption", "legacy", "sacrifice", "love", "duty"]
  },
  "content": {
    "branch_type": "narrative_delta",
    "text": "And then you saw himâ€”not as he was at the end, broken and dying, but as he was when he first held the artifact. Young. Radiant. Filled with purpose. 'I left it for you,' his voice echoed across time itself, 'because I knew you would have the strength I lacked. The strength to choose. The strength to love. The strength to let go.' The artifact hummed against your chest, a rhythm like a heartbeat, like promise, like home.",
    "character_voice": "narrator",
    "length_tokens": 82,
    "ink_tags": ["revelation", "emotional_climax", "legacy", "love"],
    "return_path": "chapter_6.choice_to_return",
    "return_path_confidence": 0.94
  },
  "constraints": {
    "max_length_tokens": 200,
    "prohibited_patterns": ["removes_mystery", "contradicts_character_arc"],
    "style_template": "noir_explorer"
  }
}
