{
  "id": "550e8400-e29b-41d4-a716-446655440005",
  "metadata": {
    "created_at": "2026-01-16T10:35:50Z",
    "llm_model": "gpt-4-turbo",
    "llm_version": "2024-01-15",
    "llm_seed": 201,
    "context_hash": "e7f8a9b0c1d2e3f4a5b6c7d8e9fa0b1c",
    "confidence_score": 0.93,
    "generation_time_ms": 1350,
    "actor": "ai_writer_v1"
  },
  "story_context": {
    "story_id": "demo-story-2024",
    "story_title": "The Lost Expedition",
    "current_scene": "chapter_2.library_discovery",
    "player_action": "examined the ancient journal more carefully",
    "player_inventory": ["torn_map"],
    "player_state": {
      "health": 100,
      "reputation": "scholarly_visitor",
      "morale": 0.9,
      "curiosity": 0.95
    },
    "character_state": {
      "librarian": {
        "mood": "intrigued",
        "relationship": "friendly",
        "objective": "protect_ancient_knowledge"
      }
    },
    "recent_events": [
      "Player entered the old library",
      "Dust motes dance in afternoon light",
      "Librarian watched player with knowing eyes"
    ],
    "narrative_pacing_hint": "exposition",
    "story_themes": ["discovery", "knowledge", "mentorship"]
  },
  "content": {
    "branch_type": "narrative_delta",
    "text": "The journal's margins were filled with annotations in a different hand—careful, scholarly notes from someone who had studied this very document centuries later. 'This compass leads not to gold,' the margin read, 'but to the Compass Bearer themselves—the one who chooses when to seek it, not before.'",
    "character_voice": "narrator",
    "length_tokens": 51,
    "ink_tags": ["discovery", "hint", "foreshadowing"],
    "return_path": "chapter_2.librarian_offers_guidance",
    "return_path_confidence": 0.96
  },
  "constraints": {
    "max_length_tokens": 100,
    "prohibited_patterns": ["direct_revelation", "contradicts_compass_lore"],
    "style_template": "noir_explorer"
  }
}
